[
 {
  "id": "aries",
  "name": "Baran",
  "gen": "Barana",
  "dat": "Baranowi",
  "element": "fire",
  "omens": [
   "Baran rusza od razu, więc firma wystartowała, zanim ktokolwiek zdecydował, jak ma wyglądać.",
   "Firma pędzi, a klienci nie nadążają za jej wizerunkiem. Baran zna to uczucie.",
   "Baran pali się do działania, a każdy dzień bez porządnej strony to stracona okazja.",
   "Baran zaczyna szybciej, niż kończy. Marce przydałby się ktoś od domykania szczegółów."
  ]
 },
 {
  "id": "taurus",
  "name": "Byk",
  "gen": "Byka",
  "dat": "Bykowi",
  "element": "earth",
  "omens": [
   "Byk lubi to, co trwałe. Firma od lat wygląda tak samo i nawet jemu zaczyna to ciążyć.",
   "Byk trzyma się sprawdzonych rozwiązań, a klienci szukają czegoś świeżego.",
   "Byk widzi jakość w produkcie, ale nie w tym, jak firma się pokazuje.",
   "Byk zachowuje spokój, choć po cichu podejrzewa, że konkurencja wygląda lepiej."
  ]
 },
 {
  "id": "gemini",
  "name": "Bliźnięta",
  "gen": "Bliźniąt",
  "dat": "Bliźniętom",
  "element": "air",
  "omens": [
   "Bliźnięta mówią do klientów dwoma głosami i żaden nie brzmi jak firma.",
   "Bliźnięta mają tysiąc pomysłów, a marka nadal nie wie, kim jest.",
   "Przekaz firmy odbija się od ścian jak echo w krypcie, a Bliźnięta słyszą każde odbicie.",
   "Dwoistość Bliźniąt wylazła na materiały firmy: dwie wersje logo i trzy kroje pisma."
  ]
 },
 {
  "id": "cancer",
  "name": "Rak",
  "gen": "Raka",
  "dat": "Rakowi",
  "element": "water",
  "omens": [
   "Rak chowa firmę w skorupie i klienci nie mają pojęcia, co jest w środku.",
   "Rak czuje więcej, niż pokazuje, a marka też ukrywa swoje najlepsze strony.",
   "Rak boi się zmian, choć odświeżony wygląd dobrze by firmie zrobił.",
   "Rak pamięta każdego klienta, ale firma nie zostawia im niczego, co warto zapamiętać."
  ]
 },
 {
  "id": "leo",
  "name": "Lew",
  "gen": "Lwa",
  "dat": "Lwu",
  "element": "fire",
  "omens": [
   "Lew chce błyszczeć, ale nikt nie widzi firmy w tłumie.",
   "Lwia duma to za mało, bo blask marki ktoś musi zaprojektować.",
   "Lew ryczy, a klienci słyszą tylko szum, bo firmie brakuje wyrazistego wizerunku.",
   "Lwu należy się korona, a firma nosi wciąż pożyczony kapelusz."
  ]
 },
 {
  "id": "virgo",
  "name": "Panna",
  "gen": "Panny",
  "dat": "Pannie",
  "element": "earth",
  "omens": [
   "Panna ma wszystko dopięte, tylko klienci gubią się na stronie.",
   "Panna zauważa każdy błąd w firmie, więc zauważy też ten w układzie strony.",
   "Panna porządkuje procesy, a wygląd firmy od lat stoi w kolejce.",
   "Panna wie, ile znaczy szczegół, i krzywe marginesy męczą ją bardziej niż klienta."
  ]
 },
 {
  "id": "libra",
  "name": "Waga",
  "gen": "Wagi",
  "dat": "Wadze",
  "element": "air",
  "omens": [
   "Waga tak długo waży opcje, że firma nadal nie ma ostatecznego wyglądu.",
   "Waga pragnie harmonii, a materiały firmy wyglądają, jakby pochodziły z różnych epok.",
   "Waga chce zadowolić wszystkich, a marka potrzebuje jednego wyraźnego stylu.",
   "Waga czuje, że coś w firmie jest nierówne, i ma rację, bo brakuje spójnego systemu wizualnego."
  ]
 },
 {
  "id": "scorpio",
  "name": "Skorpion",
  "gen": "Skorpiona",
  "dat": "Skorpionowi",
  "element": "water",
  "omens": [
   "Skorpion widzi pod powierzchnię i wie, że wizerunek firmy ją zdradza.",
   "Skorpion zna sekret firmy: jej jakość jest większa, niż pokazuje marka.",
   "Skorpion nie ufa pozorom. Klienci również nie, gdy strona wygląda na porzuconą.",
   "Skorpion czuje, że konkurencja kąsa, a firma nie ma wizerunku, którym mogłaby się bronić."
  ]
 },
 {
  "id": "sagittarius",
  "name": "Strzelec",
  "gen": "Strzelca",
  "dat": "Strzelcowi",
  "element": "fire",
  "omens": [
   "Strzelec mierzy wysoko, ale strona firmy nie dolatuje do klienta.",
   "Strzelec szuka przygód, a klienci jasnej oferty.",
   "Strzelec strzela na wszystkie strony, a marka potrzebuje jednego celu.",
   "Strzelec obiecuje daleką podróż, a firma nie dała klientom nawet mapy."
  ]
 },
 {
  "id": "capricorn",
  "name": "Koziorożec",
  "gen": "Koziorożca",
  "dat": "Koziorożcowi",
  "element": "earth",
  "omens": [
   "Koziorożec wspina się po szczeblach, a firma wciąż wygląda na początkującą.",
   "Koziorożec liczy każdy grosz, więc wizerunek czeka na budżet.",
   "Koziorożec buduje na lata. Marka powinna to pokazywać, a nie tylko deklarować.",
   "Koziorożec jest poważny, tymczasem strona firmy przemawia tonem sprzed dekady."
  ]
 },
 {
  "id": "aquarius",
  "name": "Wodnik",
  "gen": "Wodnika",
  "dat": "Wodnikowi",
  "element": "air",
  "omens": [
   "Wodnik ma wizję przyszłości, a firma wygląda jak z przeszłości.",
   "Wodnik wyprzedza epokę, tylko klienci jeszcze tego nie zauważyli.",
   "Wodnik ceni oryginalność, więc firma nie powinna wyglądać jak wszystkie inne.",
   "Wodnik rzuca pomysły w eter, a marka nie ma nośnika, który by je złapał."
  ]
 },
 {
  "id": "pisces",
  "name": "Ryby",
  "gen": "Ryb",
  "dat": "Rybom",
  "element": "water",
  "omens": [
   "Ryby płyną z prądem, a firma nie ma wizerunku, który wskazałby jej kierunek.",
   "Ryby czują klientów, ale nie umieją opowiedzieć o firmie jednym obrazem.",
   "Ryby marzą, a firmie brakuje kogoś, kto te marzenia narysuje.",
   "Ryby toną we mgle własnych pomysłów i potrzebują latarni w postaci jasnego przekazu."
  ]
 }
]
